{"schema_version":"action-graph/v1","graph_id":"g-1","nodes":[{"node_id":"n1","node_type":"decision","action_id":"a-branch","population_groups":["住宿生","走读生"]},{"node_id":"n2","node_type":"action","action_id":"a-dorm","population_groups":["住宿生"]},{"node_id":"n3","node_type":"action","action_id":"a-day","population_groups":["走读生"]},{"node_id":"n4","node_type":"notice_revision","action_id":"a-postponed"}],"edges":[{"edge_id":"e1","from_node_id":"n1","to_node_id":"n2","edge_type":"branches_to","condition_id":"cond1"},{"edge_id":"e2","from_node_id":"n1","to_node_id":"n3","edge_type":"branches_to","condition_id":"cond1"},{"edge_id":"e3","from_node_id":"n4","to_node_id":"n2","edge_type":"postpones"}]}
